concept_family	primary_owner_boundary	frontend_entry_surfaces	growth_signal_hits	growth_signal_files	canonical_model_exists	notes
identifiers	db/sql/identifier.rs + db/predicate/identifiers.rs	SQL parser + SQL lowering identifier adaptation	31	5	yes	Canonical normalization still lowers through typed identifier helpers before planner/runtime use.
predicates	db/predicate/* with planner ingress in db/query/plan/access_planner.rs	SQL predicate parse + builder filter APIs	118	8	yes	Predicate normalization and grouped boolean canonicalization remain typed and centralized despite the broader predicate/parser/runtime reorganization.
index key items	model/index.rs + db/index/key/expression.rs	schema-declared index metadata	398	33	yes	Schema/runtime key-item parity remains the main cross-surface monitoring seam and canonical_text stays diagnostic-only.
route/statement classification	db/sql/parser/* + db/executor/planning/route/contracts/shape.rs + db/sql/lowering/mod.rs	SQL statement parse/lower + route shape dispatch	106	17	yes	Statement and route-shape classification still lower once into shared typed contracts rather than branching again in session or facade layers.
projection labels	db/query/plan/expr/ast.rs + db/query/builder/text_projection.rs + db/session/sql/projection/labels.rs	SQL projection + builder projection + session projection label rendering	69	22	yes	Label rendering still derives from canonical expression nodes even though builder/session helper families remain distinct.
expression forms	db/query/plan/expr/ast.rs + db/sql/lowering/prepare.rs + db/session/sql/parameter.rs	SQL clauses + fluent builder expressions + prepared fallback parameter contracts	229	46	yes	Prepared fallback typing is now the main monitored seam, but planner expression typing still appears to own coarse semantic truth rather than being replaced by a second semantic model.
order keys	db/sql/lowering/mod.rs + db/query/plan/logical_builder.rs + db/query/plan/model.rs	SQL ORDER BY + fluent sort surfaces	515	74	yes	Order normalization still converges on typed OrderSpec contracts with canonical tie-break insertion.
entity/index identity	model/entity.rs + model/index.rs + SQL/session entity resolution	SQL entity route + typed entity/index model surfaces	1220	164	yes	Fanout remains broad usage rather than multiple competing semantic owners.
